{
  "$comment": "The Gradle distributions bin/jvm-resolve.sh will let a repo download, and the sha256 each one must hash to. This is the LISTED RELEASES half of the egress decision: github.com is reachable from the resolution container because services.gradle.org 307-redirects distribution downloads to github.com/gradle/gradle-distributions/releases, and there is no way to allow that at path granularity — squid sees only CONNECT host:443 for HTTPS, and seeing the path would mean TLS interception. So the host is allowed and the BYTES are pinned. The pin is what makes the allowance safe; without it the entry would be trust.",

  "howItIsEnforced": "bin/jvm-resolve.sh injects `distributionSha256Sum` into the gradle-wrapper.properties of the SCRATCH COPY — never the repository. The Gradle wrapper then verifies the downloaded zip itself and refuses to run on a mismatch. Enforcement is by the wrapper, not by a reviewer reading a list, which is the difference between a control and a note.",

  "unlistedIsRefused": "A repo whose wrapper asks for a distribution not listed here does not run. That is deliberate and it is the point: an unlisted version means nobody has recorded what bytes to expect, and downloading it anyway would be exactly the trust this file exists to remove. Adding a version is a human act — fetch its published sum, record it, say who checked.",

  "provenanceOfTheseHashes": "Fetched 2026-08-27 from https://services.gradle.org/distributions/gradle-<v>.zip.sha256 over TLS. That is Gradle's own published checksum, served from the canonical origin — a reasonable anchor and NOT an independent verification. `confirmedBy` is null on every entry below because nobody has cross-checked them against a second source. That field is the honest record of how much this list is worth, and it should be filled in rather than assumed.",

  "derivedFrom": "Each entry is a distribution that a scanned gradle-wrapper.properties declares, enumerated rather than guessed. A repo that already pins its own distribution with distributionSha256Sum needs nothing from this file.",

  "distributions": [
    { "version": "9.7.1", "kind": "bin", "sha256": "acd53f1edaf02f1a8ff99879f8a34b302661a057d9b063ae9e35b552f804d20a", "repos": 1, "confirmedBy": null },
    { "version": "9.7.0", "kind": "bin", "sha256": "84fbba45c7f4c64abc77460e1c00f541e9f960e3c7ed2538f1ede19eacd873ae", "repos": 2, "confirmedBy": null },
    { "version": "9.1.0", "kind": "bin", "sha256": "a17ddd85a26b6a7f5ddb71ff8b05fc5104c0202c6e64782429790c933686c806", "repos": 1, "confirmedBy": null },
    { "version": "8.14.5", "kind": "bin", "sha256": "6f74b601422d6d6fc4e1f9a1ab6522f642c2fdcbc15ae33ebd30ba3d7198e854", "repos": 2, "confirmedBy": null },
    { "version": "8.14.4", "kind": "bin", "sha256": "f1771298a70f6db5a29daf62378c4e18a17fc33c9ba6b14362e0cdf40610380d", "repos": 1, "confirmedBy": null },
    { "version": "8.14.3", "kind": "all", "sha256": "ed1a8d686605fd7c23bdf62c7fc7add1c5b23b2bbc3721e661934ef4a4911d7c", "repos": 2, "confirmedBy": null },
    { "version": "8.9", "kind": "all", "sha256": "258e722ec21e955201e31447b0aed14201765a3bfbae296a46cf60b70e66db70", "repos": 1, "confirmedBy": null },
    { "version": "8.7", "kind": "bin", "sha256": "544c35d6bd849ae8a5ed0bcea39ba677dc40f49df7d1835561582da2009b961d", "repos": 1, "confirmedBy": null }
  ]
}
